<?xml version="1.0" encoding="UTF-8"?>
<TablaClubs xmlns:xsi="http://www.w3.org/2001/XMLSchema-instance" xsi:noNamespaceSchemaLocation="/XMLyXSD/XSDClubes.xsd">
<temporada id="2022">
    <club>
        <codigo>22495031</codigo>
        <nombre>dfvsfdbbgfb</nombre>
        <estadio>Madrid calle Hiujnfd 74</estadio>
        <presidente>Tailer Derden</presidente>
        <cantidadSocios>2001</cantidadSocios>
        <ciudad>Madrid</ciudad>
        <cantidad>15</cantidad>
    </club>

    <club>
        <nombre>Wsdfbgn gbgbb Club</nombre>
        <estadio>Madrid calle Hiujnfd 74</estadio>
        <presidente>Robert Polson</presidente>
        <cantidadSocios>1994</cantidadSocios>
        <ciudad>Bilbao</ciudad>
        <codigo>22495031</codigo>
        <cantidad>13</cantidad>
    </club>
</temporada>
<temporada id="2023">
    <club>
        <codigo>22495031</codigo>
        <nombre>Fight Club</nombre>
        <estadio>Madrid calle Hiujnfd 74</estadio>
        <presidente>Tailer Derden</presidente>
        <cantidadSocios>2001</cantidadSocios>
        <ciudad>Madrid</ciudad>
        <cantidad>15</cantidad>
    </club>

    <club>
        <nombre>WaterPolo Club</nombre>
        <estadio>Madrid calle Hiujnfd 74</estadio>
        <presidente>Robert Polson</presidente>
        <cantidadSocios>1994</cantidadSocios>
        <ciudad>Bilbao</ciudad>
        <codigo>22495031</codigo>
        <cantidad>13</cantidad>
    </club>
</temporada>
<temporada id="2024">
    <club>
        <codigo>22495031</codigo>
        <nombre>Fight Club</nombre>
        <estadio>Madrid calle Hiujnfd 74</estadio>
        <presidente>Tailer Derden</presidente>
        <cantidadSocios>2001</cantidadSocios>
        <ciudad>Madrid</ciudad>
        <cantidad>15</cantidad>
    </club>

    <club>
        <nombre>WaterPolo Club</nombre>
        <estadio>Madrid calle Hiujnfd 74</estadio>
        <presidente>Robert Polson</presidente>
        <cantidadSocios>1994</cantidadSocios>
        <ciudad>Bilbao</ciudad>
        <codigo>22495031</codigo>
        <cantidad>13</cantidad>
    </club>
    <club>
        <nombre>WaterPolo Club</nombre>
        <estadio>Madrid calle Hiujnfd 74</estadio>
        <presidente>Robert Polson</presidente>
        <cantidadSocios>1994</cantidadSocios>
        <ciudad>Bilbao</ciudad>
        <codigo>22495031</codigo>
        <cantidad>13</cantidad>
    </club>
</temporada>
</TablaClubs>